awardYear,category,name,gender,birth_date,affiliation_1,birth_cityNow,birth_countryNow,motivation,award_link,laureate_link,age,affiliation_country,affiliation_zone,birth_zone,affiliation_lat,affiliation_lon,affiliation_zone_lat,affiliation_zone_lon,birth_lat,birth_lon,birth_zone_lat,birth_zone_lon
1943,Medicine,Henrik Dam,male,1895-02-21,"Polytechnic Institute, Copenhagen, Denmark",Copenhagen,Denmark,for his discovery of vitamin K,https://masterdataapi.nobelprize.org/2/nobelPrize/med/1943,http://masterdataapi.nobelprize.org/2/laureate/335,48,Denmark,Europe,Europe,56.31,9.69,48.55,5.72,56.31,9.69,48.55,5.72
1943,Physics,Otto Stern,male,1888-02-17,"Carnegie Institute of Technology, Pittsburgh, PA, USA",Zory,Poland,for his contribution to the development of the molecular ray method and his discovery of the magnetic moment of the proton,https://masterdataapi.nobelprize.org/2/nobelPrize/phy/1943,http://masterdataapi.nobelprize.org/2/laureate/48,55,USA,North America,Poland,38.51,-100.3,38.51,-100.3,0.0,0.0,0.0,0.0
1943,Chemistry,George de Hevesy,male,1885-08-01,"Stockholm University, Stockholm, Sweden",Budapest,Hungary,for his work on the use of isotopes as tracers in the study of chemical processes,https://masterdataapi.nobelprize.org/2/nobelPrize/che/1943,http://masterdataapi.nobelprize.org/2/laureate/201,58,Sweden,Europe,Europe,60.8,15.21,48.55,5.72,46.66,18.98,48.55,5.72
1944,Chemistry,Otto Hahn,male,1879-03-08,"Kaiser-Wilhelm-Institut (now Max-Planck Institut) für Chemie, Berlin-Dahlem, Germany",Frankfurt-on-the-Main,Germany,for his discovery of the fission of heavy nuclei,https://masterdataapi.nobelprize.org/2/nobelPrize/che/1944,http://masterdataapi.nobelprize.org/2/laureate/202,65,Germany,Europe,Europe,51.42,10.6,48.55,5.72,51.42,10.6,48.55,5.72
1944,Literature,Johannes V. Jensen,male,1873-01-20,,Farsø,Denmark,"for the rare strength and fertility of his poetic imagination with which is combined an intellectual curiosity of wide scope and a bold, freshly creative style",https://masterdataapi.nobelprize.org/2/nobelPrize/lit/1944,http://masterdataapi.nobelprize.org/2/laureate/614,71,,,Europe,0.0,0.0,0.0,0.0,56.31,9.69,48.55,5.72
1944,Physics,Isidor Isaac Rabi,male,1898-07-29,"Columbia University, New York, NY, USA",Rymanow,Poland,for his resonance method for recording the magnetic properties of atomic nuclei,https://masterdataapi.nobelprize.org/2/nobelPrize/phy/1944,http://masterdataapi.nobelprize.org/2/laureate/49,46,USA,North America,Poland,38.51,-100.3,38.51,-100.3,0.0,0.0,0.0,0.0
1944,Medicine,Herbert S. Gasser,male,1888-07-05,"Rockefeller Institute for Medical Research, New York, NY, USA","Platteville, WI",USA,for their discoveries relating to the highly differentiated functions of single nerve fibres,https://masterdataapi.nobelprize.org/2/nobelPrize/med/1944,http://masterdataapi.nobelprize.org/2/laureate/338,56,USA,North America,North America,38.51,-100.3,38.51,-100.3,38.51,-100.3,38.51,-100.3
1944,Medicine,Joseph Erlanger,male,1874-01-05,"Washington University, St. Louis, MO, USA","San Francisco, CA",USA,for their discoveries relating to the highly differentiated functions of single nerve fibres,https://masterdataapi.nobelprize.org/2/nobelPrize/med/1944,http://masterdataapi.nobelprize.org/2/laureate/337,70,USA,North America,North America,38.51,-100.3,38.51,-100.3,38.51,-100.3,38.51,-100.3
1945,Medicine,Sir Alexander Fleming,male,1881-08-06,"London University, London, United Kingdom",Lochfield,Scotland,for the discovery of penicillin and its curative effect in various infectious diseases,https://masterdataapi.nobelprize.org/2/nobelPrize/med/1945,http://masterdataapi.nobelprize.org/2/laureate/339,64,United Kingdom,Europe,Scotland,52.94,-1.23,48.55,5.72,0.0,0.0,0.0,0.0
1945,Peace,Cordell Hull,male,1871-10-02,,"Olympus, TN",USA,for his indefatigable work for international understanding and his pivotal role in establishing the United Nations,https://masterdataapi.nobelprize.org/2/nobelPrize/pea/1945,http://masterdataapi.nobelprize.org/2/laureate/505,74,,,North America,0.0,0.0,0.0,0.0,38.51,-100.3,38.51,-100.3
1945,Physics,Wolfgang Pauli,male,1900-04-25,"Princeton University, Princeton, NJ, USA",Vienna,Austria,"for the discovery of the Exclusion Principle, also called the Pauli Principle",https://masterdataapi.nobelprize.org/2/nobelPrize/phy/1945,http://masterdataapi.nobelprize.org/2/laureate/50,45,USA,North America,Europe,38.51,-100.3,38.51,-100.3,47.35,14.47,48.55,5.72
1945,Medicine,Sir Howard Florey,male,1898-09-24,"University of Oxford, Oxford, United Kingdom",Adelaide,Australia,for the discovery of penicillin and its curative effect in various infectious diseases,https://masterdataapi.nobelprize.org/2/nobelPrize/med/1945,http://masterdataapi.nobelprize.org/2/laureate/341,47,United Kingdom,Europe,Australia,52.94,-1.23,48.55,5.72,-26.32,134.63,-26.32,134.63
1945,Literature,Gabriela Mistral,female,1889-04-07,,Vicuña,Chile,"for her lyric poetry which, inspired by powerful emotions, has made her name a symbol of the idealistic aspirations of the entire Latin American world",https://masterdataapi.nobelprize.org/2/nobelPrize/lit/1945,http://masterdataapi.nobelprize.org/2/laureate/615,56,,,Chile,0.0,0.0,0.0,0.0,0.0,0.0,0.0,0.0
1945,Chemistry,Artturi Virtanen,male,1895-01-15,"University of Helsinki, Helsinki, Finland",Helsinki,Finland,"for his research and inventions in agricultural and nutrition chemistry, especially for his fodder preservation method",https://masterdataapi.nobelprize.org/2/nobelPrize/che/1945,http://masterdataapi.nobelprize.org/2/laureate/203,50,Finland,Europe,Europe,63.55,27.32,48.55,5.72,63.55,27.32,48.55,5.72
1945,Medicine,Ernst B. Chain,male,1906-06-19,"University of Oxford, Oxford, United Kingdom",Berlin,Germany,for the discovery of penicillin and its curative effect in various infectious diseases,https://masterdataapi.nobelprize.org/2/nobelPrize/med/1945,http://masterdataapi.nobelprize.org/2/laureate/340,39,United Kingdom,Europe,Europe,52.94,-1.23,48.55,5.72,51.42,10.6,48.55,5.72
1946,Chemistry,Wendell M. Stanley,male,1904-08-16,"Rockefeller Institute for Medical Research, Princeton, NJ, USA","Ridgeville, IN",USA,for their preparation of enzymes and virus proteins in a pure form,https://masterdataapi.nobelprize.org/2/nobelPrize/che/1946,http://masterdataapi.nobelprize.org/2/laureate/206,42,USA,North America,North America,38.51,-100.3,38.51,-100.3,38.51,-100.3,38.51,-100.3
1946,Chemistry,James B. Sumner,male,1887-11-19,"Cornell University, Ithaca, NY, USA","Canton, MA",USA,for his discovery that enzymes can be crystallized,https://masterdataapi.nobelprize.org/2/nobelPrize/che/1946,http://masterdataapi.nobelprize.org/2/laureate/204,59,USA,North America,North America,38.51,-100.3,38.51,-100.3,38.51,-100.3,38.51,-100.3
1946,Chemistry,John H. Northrop,male,1891-07-05,"Rockefeller Institute for Medical Research, Princeton, NJ, USA","Yonkers, NY",USA,for their preparation of enzymes and virus proteins in a pure form,https://masterdataapi.nobelprize.org/2/nobelPrize/che/1946,http://masterdataapi.nobelprize.org/2/laureate/205,55,USA,North America,North America,38.51,-100.3,38.51,-100.3,38.51,-100.3,38.51,-100.3
1946,Medicine,Hermann J. Muller,male,1890-12-21,"Indiana University, Bloomington, IN, USA","New York, NY",USA,for the discovery of the production of mutations by means of X-ray irradiation,https://masterdataapi.nobelprize.org/2/nobelPrize/med/1946,http://masterdataapi.nobelprize.org/2/laureate/342,56,USA,North America,North America,38.51,-100.3,38.51,-100.3,38.51,-100.3,38.51,-100.3
1946,Literature,Hermann Hesse,male,1877-07-02,,Calw,Germany,"for his inspired writings which, while growing in boldness and penetration, exemplify the classical humanitarian ideals and high qualities of style",https://masterdataapi.nobelprize.org/2/nobelPrize/lit/1946,http://masterdataapi.nobelprize.org/2/laureate/617,69,,,Europe,0.0,0.0,0.0,0.0,51.42,10.6,48.55,5.72
1946,Peace,John R. Mott,male,1865-05-25,,"Livingston Manor, NY",USA,for his contribution to the creation of a peace-promoting religious brotherhood across national boundaries,https://masterdataapi.nobelprize.org/2/nobelPrize/pea/1946,http://masterdataapi.nobelprize.org/2/laureate/507,81,,,North America,0.0,0.0,0.0,0.0,38.51,-100.3,38.51,-100.3
1946,Peace,Emily Greene Balch,female,1867-01-08,,"Boston, MA",USA,for her lifelong work for the cause of peace,https://masterdataapi.nobelprize.org/2/nobelPrize/pea/1946,http://masterdataapi.nobelprize.org/2/laureate/506,79,,,North America,0.0,0.0,0.0,0.0,38.51,-100.3,38.51,-100.3
1946,Physics,Percy W. Bridgman,male,1882-04-21,"Harvard University, Cambridge, MA, USA","Cambridge, MA",USA,"for the invention of an apparatus to produce extremely high pressures, and for the discoveries he made therewith in the field of high pressure physics",https://masterdataapi.nobelprize.org/2/nobelPrize/phy/1946,http://masterdataapi.nobelprize.org/2/laureate/51,64,USA,North America,North America,38.51,-100.3,38.51,-100.3,38.51,-100.3,38.51,-100.3
1947,Literature,André Gide,male,1869-11-22,,Paris,France,"for his comprehensive and artistically significant writings, in which human problems and conditions have been presented with a fearless love of truth and keen psychological insight",https://masterdataapi.nobelprize.org/2/nobelPrize/lit/1947,http://masterdataapi.nobelprize.org/2/laureate/618,78,,,Europe,0.0,0.0,0.0,0.0,46.97,2.7,48.55,5.72
1947,Medicine,Bernardo Houssay,male,1887-04-10,"Instituto de Biologia y Medicina Experimental (Institute for Biology and Experimental Medicine), Buenos Aires, Argentina",Buenos Aires,Argentina,for his discovery of the part played by the hormone of the anterior pituitary lobe in the metabolism of sugar,https://masterdataapi.nobelprize.org/2/nobelPrize/med/1947,http://masterdataapi.nobelprize.org/2/laureate/345,60,Argentina,Argentina,Argentina,-37.57,-66.3,-37.57,-66.3,-37.57,-66.3,-37.57,-66.3
1947,Chemistry,Sir Robert Robinson,male,1886-09-13,"University of Oxford, Oxford, United Kingdom","Rufford, near Chesterfield",United Kingdom,"for his investigations on plant products of biological importance, especially the alkaloids",https://masterdataapi.nobelprize.org/2/nobelPrize/che/1947,http://masterdataapi.nobelprize.org/2/laureate/207,61,United Kingdom,Europe,Europe,52.94,-1.23,48.55,5.72,52.94,-1.23,48.55,5.72
1947,Medicine,Carl Cori,male,1896-12-05,"Washington University, St. Louis, MO, USA",Prague,Czech Republic,for their discovery of the course of the catalytic conversion of glycogen,https://masterdataapi.nobelprize.org/2/nobelPrize/med/1947,http://masterdataapi.nobelprize.org/2/laureate/343,51,USA,North America,Europe,38.51,-100.3,38.51,-100.3,49.9,15.61,48.55,5.72
1947,Physics,Edward V. Appleton,male,1892-09-06,"Department of Scientific and Industrial Research, London, United Kingdom",Bradford,United Kingdom,for his investigations of the physics of the upper atmosphere especially for the discovery of the so-called Appleton layer,https://masterdataapi.nobelprize.org/2/nobelPrize/phy/1947,http://masterdataapi.nobelprize.org/2/laureate/52,55,United Kingdom,Europe,Europe,52.94,-1.23,48.55,5.72,52.94,-1.23,48.55,5.72
1947,Medicine,Gerty Cori,female,1896-08-15,"Washington University, St. Louis, MO, USA",Prague,Czech Republic,for their discovery of the course of the catalytic conversion of glycogen,https://masterdataapi.nobelprize.org/2/nobelPrize/med/1947,http://masterdataapi.nobelprize.org/2/laureate/344,51,USA,North America,Europe,38.51,-100.3,38.51,-100.3,49.9,15.61,48.55,5.72
1948,Literature,T.S. Eliot,male,1888-09-26,,"St. Louis, MO",USA,"for his outstanding, pioneer contribution to present-day poetry",https://masterdataapi.nobelprize.org/2/nobelPrize/lit/1948,http://masterdataapi.nobelprize.org/2/laureate/619,60,,,North America,0.0,0.0,0.0,0.0,38.51,-100.3,38.51,-100.3
1948,Physics,Patrick M.S. Blackett,male,1897-11-18,"Victoria University, Manchester, United Kingdom",London,United Kingdom,"for his development of the Wilson cloud chamber method, and his discoveries therewith in the fields of nuclear physics and cosmic radiation",https://masterdataapi.nobelprize.org/2/nobelPrize/phy/1948,http://masterdataapi.nobelprize.org/2/laureate/53,51,United Kingdom,Europe,Europe,52.94,-1.23,48.55,5.72,52.94,-1.23,48.55,5.72
1948,Medicine,Paul Müller,male,1899-01-12,"Laboratorium der Farben-Fabriken J.R. Geigy A.G. (Laboratory of the J.R. Geigy Dye-Factory Co.), Basel, Switzerland",Olten,Switzerland,for his discovery of the high efficiency of DDT as a contact poison against several arthropods,https://masterdataapi.nobelprize.org/2/nobelPrize/med/1948,http://masterdataapi.nobelprize.org/2/laureate/346,49,Switzerland,Europe,Europe,47.0,8.43,48.55,5.72,47.0,8.43,48.55,5.72
1948,Chemistry,Arne Tiselius,male,1902-08-10,"Uppsala University, Uppsala, Sweden",Stockholm,Sweden,"for his research on electrophoresis and adsorption analysis, especially for his discoveries concerning the complex nature of the serum proteins",https://masterdataapi.nobelprize.org/2/nobelPrize/che/1948,http://masterdataapi.nobelprize.org/2/laureate/208,46,Sweden,Europe,Europe,60.8,15.21,48.55,5.72,60.8,15.21,48.55,5.72
1949,Chemistry,William F. Giauque,male,1895-05-12,"University of California, Berkeley, CA, USA",Niagara Falls,Canada,"for his contributions in the field of chemical thermodynamics, particularly concerning the behaviour of substances at extremely low temperatures",https://masterdataapi.nobelprize.org/2/nobelPrize/che/1949,http://masterdataapi.nobelprize.org/2/laureate/209,54,USA,North America,North America,38.51,-100.3,38.51,-100.3,54.98,-100.53,38.51,-100.3
1949,Physics,Hideki Yukawa,male,1907-01-23,"Kyoto Imperial University, Kyoto, Japan",Tokyo,Japan,for his prediction of the existence of mesons on the basis of theoretical work on nuclear forces,https://masterdataapi.nobelprize.org/2/nobelPrize/phy/1949,http://masterdataapi.nobelprize.org/2/laureate/54,42,Japan,Japan,Japan,36.98,139.59,36.98,139.59,36.98,139.59,36.98,139.59
1949,Peace,Lord Boyd Orr,male,1880-09-23,,Kilmaurs,Scotland,"for his lifelong effort to conquer hunger and want, thereby helping to remove a major cause of military conflict and war",https://masterdataapi.nobelprize.org/2/nobelPrize/pea/1949,http://masterdataapi.nobelprize.org/2/laureate/510,69,,,Scotland,0.0,0.0,0.0,0.0,0.0,0.0,0.0,0.0
1949,Medicine,Egas Moniz,male,1874-11-29,"University of Lisbon, Lisbon, Portugal",Avanca,Portugal,for his discovery of the therapeutic value of leucotomy in certain psychoses,https://masterdataapi.nobelprize.org/2/nobelPrize/med/1949,http://masterdataapi.nobelprize.org/2/laureate/348,75,Portugal,Europe,Europe,39.76,-8.27,48.55,5.72,39.76,-8.27,48.55,5.72
1949,Literature,William Faulkner,male,1897-09-25,,"New Albany, MS",USA,for his powerful and artistically unique contribution to the modern American novel,https://masterdataapi.nobelprize.org/2/nobelPrize/lit/1949,http://masterdataapi.nobelprize.org/2/laureate/620,52,,,North America,0.0,0.0,0.0,0.0,38.51,-100.3,38.51,-100.3
1949,Medicine,Walter Hess,male,1881-03-17,"University of Zurich, Zurich, Switzerland",Frauenfeld,Switzerland,for his discovery of the functional organization of the interbrain as a coordinator of the activities of the internal organs,https://masterdataapi.nobelprize.org/2/nobelPrize/med/1949,http://masterdataapi.nobelprize.org/2/laureate/347,68,Switzerland,Europe,Europe,47.0,8.43,48.55,5.72,47.0,8.43,48.55,5.72
1950,Literature,Bertrand Russell,male,1872-05-18,,Trelleck,United Kingdom,in recognition of his varied and significant writings in which he champions humanitarian ideals and freedom of thought,https://masterdataapi.nobelprize.org/2/nobelPrize/lit/1950,http://masterdataapi.nobelprize.org/2/laureate/621,78,,,Europe,0.0,0.0,0.0,0.0,52.94,-1.23,48.55,5.72
1950,Medicine,Edward C. Kendall,male,1886-03-08,"Mayo Clinic, Rochester, MN, USA","South Norwalk, CT",USA,"for their discoveries relating to the hormones of the adrenal cortex, their structure and biological effects",https://masterdataapi.nobelprize.org/2/nobelPrize/med/1950,http://masterdataapi.nobelprize.org/2/laureate/349,64,USA,North America,North America,38.51,-100.3,38.51,-100.3,38.51,-100.3,38.51,-100.3
1950,Medicine,Tadeus Reichstein,male,1897-07-20,"Basel University, Basel, Switzerland",Wloclawek,Poland,"for their discoveries relating to the hormones of the adrenal cortex, their structure and biological effects",https://masterdataapi.nobelprize.org/2/nobelPrize/med/1950,http://masterdataapi.nobelprize.org/2/laureate/350,53,Switzerland,Europe,Poland,47.0,8.43,48.55,5.72,0.0,0.0,0.0,0.0
1950,Chemistry,Otto Diels,male,1876-01-23,"Kiel University, Kiel, Germany",Hamburg,Germany,for their discovery and development of the diene synthesis,https://masterdataapi.nobelprize.org/2/nobelPrize/che/1950,http://masterdataapi.nobelprize.org/2/laureate/210,74,Germany,Europe,Europe,51.42,10.6,48.55,5.72,51.42,10.6,48.55,5.72
1950,Medicine,Philip S. Hench,male,1896-02-28,"Mayo Clinic, Rochester, MN, USA","Pittsburgh, PA",USA,"for their discoveries relating to the hormones of the adrenal cortex, their structure and biological effects",https://masterdataapi.nobelprize.org/2/nobelPrize/med/1950,http://masterdataapi.nobelprize.org/2/laureate/351,54,USA,North America,North America,38.51,-100.3,38.51,-100.3,38.51,-100.3,38.51,-100.3
1950,Chemistry,Kurt Alder,male,1902-07-10,"Cologne University, Cologne, Germany",Chorzów,Poland,for their discovery and development of the diene synthesis,https://masterdataapi.nobelprize.org/2/nobelPrize/che/1950,http://masterdataapi.nobelprize.org/2/laureate/211,48,Germany,Europe,Poland,51.42,10.6,48.55,5.72,0.0,0.0,0.0,0.0
1950,Peace,Ralph Bunche,male,1904-08-07,"Harvard University, Cambridge, MA, USA","Detroit, MI",USA,for his work as mediator in Palestine in 1948-1949,https://masterdataapi.nobelprize.org/2/nobelPrize/pea/1950,http://masterdataapi.nobelprize.org/2/laureate/511,46,USA,North America,North America,38.51,-100.3,38.51,-100.3,38.51,-100.3,38.51,-100.3
1950,Physics,Cecil Powell,male,1903-12-05,"Bristol University, Bristol, United Kingdom",Tonbridge,United Kingdom,for his development of the photographic method of studying nuclear processes and his discoveries regarding mesons made with this method,https://masterdataapi.nobelprize.org/2/nobelPrize/phy/1950,http://masterdataapi.nobelprize.org/2/laureate/55,47,United Kingdom,Europe,Europe,52.94,-1.23,48.55,5.72,52.94,-1.23,48.55,5.72
1951,Medicine,Max Theiler,male,1899-01-30,"Laboratories of the Division of Medicine and Public Health, Rockefeller Foundation, New York, NY, USA",Pretoria,South Africa,for his discoveries concerning yellow fever and how to combat it,https://masterdataapi.nobelprize.org/2/nobelPrize/med/1951,http://masterdataapi.nobelprize.org/2/laureate/352,52,USA,North America,South Africa,38.51,-100.3,38.51,-100.3,0.0,0.0,0.0,0.0
1951,Literature,Pär Lagerkvist,male,1891-05-23,,Växjö,Sweden,for the artistic vigour and true independence of mind with which he endeavours in his poetry to find answers to the eternal questions confronting mankind,https://masterdataapi.nobelprize.org/2/nobelPrize/lit/1951,http://masterdataapi.nobelprize.org/2/laureate/622,60,,,Europe,0.0,0.0,0.0,0.0,60.8,15.21,48.55,5.72
1951,Physics,John Cockcroft,male,1897-05-27,"Atomic Energy Research Establishment, Harwell, Berkshire, United Kingdom",Todmorden,United Kingdom,for their pioneer work on the transmutation of atomic nuclei by artificially accelerated atomic particles,https://masterdataapi.nobelprize.org/2/nobelPrize/phy/1951,http://masterdataapi.nobelprize.org/2/laureate/56,54,United Kingdom,Europe,Europe,52.94,-1.23,48.55,5.72,52.94,-1.23,48.55,5.72
1951,Physics,Ernest T.S. Walton,male,1903-10-06,"Trinity College, Dublin, Ireland",Dungarvan,Ireland,for their pioneer work on the transmutation of atomic nuclei by artificially accelerated atomic particles,https://masterdataapi.nobelprize.org/2/nobelPrize/phy/1951,http://masterdataapi.nobelprize.org/2/laureate/57,48,Ireland,Europe,Europe,53.39,-8.32,48.55,5.72,53.39,-8.32,48.55,5.72
1951,Chemistry,Glenn T. Seaborg,male,1912-04-19,"University of California, Berkeley, CA, USA","Ishpeming, MI",USA,for their discoveries in the chemistry of the transuranium elements,https://masterdataapi.nobelprize.org/2/nobelPrize/che/1951,http://masterdataapi.nobelprize.org/2/laureate/213,39,USA,North America,North America,38.51,-100.3,38.51,-100.3,38.51,-100.3,38.51,-100.3
1951,Peace,Léon Jouhaux,male,1879-07-01,,Paris,France,for having devoted his life to the fight against war through the promotion of social justice and brotherhood among men and nations,https://masterdataapi.nobelprize.org/2/nobelPrize/pea/1951,http://masterdataapi.nobelprize.org/2/laureate/512,72,,,Europe,0.0,0.0,0.0,0.0,46.97,2.7,48.55,5.72
1951,Chemistry,Edwin M. McMillan,male,1907-09-18,"University of California, Berkeley, CA, USA","Redondo Beach, CA",USA,for their discoveries in the chemistry of the transuranium elements,https://masterdataapi.nobelprize.org/2/nobelPrize/che/1951,http://masterdataapi.nobelprize.org/2/laureate/212,44,USA,North America,North America,38.51,-100.3,38.51,-100.3,38.51,-100.3,38.51,-100.3
1952,Physics,E. M. Purcell,male,1912-08-30,"Harvard University, Cambridge, MA, USA","Taylorville, IL",USA,for their development of new methods for nuclear magnetic precision measurements and discoveries in connection therewith,https://masterdataapi.nobelprize.org/2/nobelPrize/phy/1952,http://masterdataapi.nobelprize.org/2/laureate/59,40,USA,North America,North America,38.51,-100.3,38.51,-100.3,38.51,-100.3,38.51,-100.3
1952,Peace,Albert Schweitzer,male,1875-01-14,,Kaysersberg,France,"for his altruism, reverence for life, and tireless humanitarian work  which has helped making the idea of brotherhood between men and nations a living one",https://masterdataapi.nobelprize.org/2/nobelPrize/pea/1952,http://masterdataapi.nobelprize.org/2/laureate/513,77,,,Europe,0.0,0.0,0.0,0.0,46.97,2.7,48.55,5.72
1952,Chemistry,Archer J.P. Martin,male,1910-03-01,"National Institute for Medical Research, London, United Kingdom",London,United Kingdom,for their invention of partition chromatography,https://masterdataapi.nobelprize.org/2/nobelPrize/che/1952,http://masterdataapi.nobelprize.org/2/laureate/214,42,United Kingdom,Europe,Europe,52.94,-1.23,48.55,5.72,52.94,-1.23,48.55,5.72
1952,Medicine,Selman A. Waksman,male,1888-07-22,"Rutgers University, New Brunswick, NJ, USA",Nova Pryluka,Ukraine,"for his discovery of streptomycin, the first antibiotic effective against tuberculosis",https://masterdataapi.nobelprize.org/2/nobelPrize/med/1952,http://masterdataapi.nobelprize.org/2/laureate/353,64,USA,North America,Ukraine,38.51,-100.3,38.51,-100.3,0.0,0.0,0.0,0.0
1952,Literature,François Mauriac,male,1885-10-11,,Bordeaux,France,for the deep spiritual insight and the artistic intensity with which he has in his novels penetrated the drama of human life,https://masterdataapi.nobelprize.org/2/nobelPrize/lit/1952,http://masterdataapi.nobelprize.org/2/laureate/623,67,,,Europe,0.0,0.0,0.0,0.0,46.97,2.7,48.55,5.72
1952,Physics,Felix Bloch,male,1905-10-23,"Stanford University, Stanford, CA, USA",Zurich,Switzerland,for their development of new methods for nuclear magnetic precision measurements and discoveries in connection therewith,https://masterdataapi.nobelprize.org/2/nobelPrize/phy/1952,http://masterdataapi.nobelprize.org/2/laureate/58,47,USA,North America,Europe,38.51,-100.3,38.51,-100.3,47.0,8.43,48.55,5.72
1952,Chemistry,Richard L.M. Synge,male,1914-10-28,"Rowett Research Institute, Bucksburn (Scotland), United Kingdom",Liverpool,United Kingdom,for their invention of partition chromatography,https://masterdataapi.nobelprize.org/2/nobelPrize/che/1952,http://masterdataapi.nobelprize.org/2/laureate/215,38,United Kingdom,Europe,Europe,52.94,-1.23,48.55,5.72,52.94,-1.23,48.55,5.72
1953,Literature,Winston Churchill,male,1874-11-30,,Woodstock,United Kingdom,for his mastery of historical and biographical description as well as for brilliant oratory in defending exalted human values,https://masterdataapi.nobelprize.org/2/nobelPrize/lit/1953,http://masterdataapi.nobelprize.org/2/laureate/624,79,,,Europe,0.0,0.0,0.0,0.0,52.94,-1.23,48.55,5.72
1953,Chemistry,Hermann Staudinger,male,1881-03-23,"University of Freiburg, Breisgau, Germany",Worms,Germany,for his discoveries in the field of macromolecular chemistry,https://masterdataapi.nobelprize.org/2/nobelPrize/che/1953,http://masterdataapi.nobelprize.org/2/laureate/216,72,Germany,Europe,Europe,51.42,10.6,48.55,5.72,51.42,10.6,48.55,5.72
1953,Medicine,Fritz Lipmann,male,1899-06-12,"Harvard Medical School, Boston, MA, USA",Kaliningrad,Russia,for his discovery of co-enzyme A and its importance for intermediary metabolism,https://masterdataapi.nobelprize.org/2/nobelPrize/med/1953,http://masterdataapi.nobelprize.org/2/laureate/355,54,USA,North America,Russia,38.51,-100.3,38.51,-100.3,61.1,81.38,61.1,81.38
1953,Medicine,Hans Krebs,male,1900-08-25,"Sheffield University, Sheffield, United Kingdom",Hildesheim,Germany,for his discovery of the citric acid cycle,https://masterdataapi.nobelprize.org/2/nobelPrize/med/1953,http://masterdataapi.nobelprize.org/2/laureate/354,53,United Kingdom,Europe,Europe,52.94,-1.23,48.55,5.72,51.42,10.6,48.55,5.72
1953,Physics,Frits Zernike,male,1888-07-16,"Groningen University, Groningen, the Netherlands",Amsterdam,the Netherlands,"for his demonstration of the phase contrast method, especially for his invention of the phase contrast microscope",https://masterdataapi.nobelprize.org/2/nobelPrize/phy/1953,http://masterdataapi.nobelprize.org/2/laureate/60,65,the Netherlands,Europe,Europe,52.52,5.74,48.55,5.72,52.52,5.74,48.55,5.72
