awardYear,category,name,gender,birth_date,affiliation_1,birth_cityNow,birth_countryNow,motivation,award_link,laureate_link,age,affiliation_country,affiliation_zone,birth_zone,affiliation_lat,affiliation_lon,affiliation_zone_lat,affiliation_zone_lon,birth_lat,birth_lon,birth_zone_lat,birth_zone_lon
1997,Physics,Claude Cohen-Tannoudji,male,1933-04-01,"Collège de France, Paris, France",Constantine,Algeria,for development of methods to cool and trap atoms with laser light,https://masterdataapi.nobelprize.org/2/nobelPrize/phy/1997,http://masterdataapi.nobelprize.org/2/laureate/153,64,France,Europe,Algeria,46.97,2.7,48.55,5.72,0.0,0.0,0.0,0.0
1997,Physics,William D. Phillips,male,1948-11-05,"National Institute of Standards and Technology, Gaithersburg, MD, USA","Wilkes-Barre, PA",USA,for development of methods to cool and trap atoms with laser light,https://masterdataapi.nobelprize.org/2/nobelPrize/phy/1997,http://masterdataapi.nobelprize.org/2/laureate/154,49,USA,North America,North America,38.51,-100.3,38.51,-100.3,38.51,-100.3,38.51,-100.3
1997,Chemistry,Jens C. Skou,male,1918-10-08,"Aarhus University, Aarhus, Denmark",Lemvig,Denmark,"for the first discovery of an ion-transporting enzyme, Na+, K+ -ATPase",https://masterdataapi.nobelprize.org/2/nobelPrize/che/1997,http://masterdataapi.nobelprize.org/2/laureate/289,79,Denmark,Europe,Europe,56.31,9.69,48.55,5.72,56.31,9.69,48.55,5.72
1997,Economic Sciences,Robert C. Merton,male,1944-07-31,"Harvard University, Cambridge, MA, USA","New York, NY",USA,for a new method to determine the value of derivatives,https://masterdataapi.nobelprize.org/2/nobelPrize/eco/1997,http://masterdataapi.nobelprize.org/2/laureate/717,53,USA,North America,North America,38.51,-100.3,38.51,-100.3,38.51,-100.3,38.51,-100.3
1997,Chemistry,Paul D. Boyer,male,1918-07-31,"University of California, Los Angeles, CA, USA","Provo, UT",USA,for their elucidation of the enzymatic mechanism underlying the synthesis of adenosine triphosphate (ATP),https://masterdataapi.nobelprize.org/2/nobelPrize/che/1997,http://masterdataapi.nobelprize.org/2/laureate/287,79,USA,North America,North America,38.51,-100.3,38.51,-100.3,38.51,-100.3,38.51,-100.3
1997,Literature,Dario Fo,male,1926-03-24,,Leggiuno-Sangiano,Italy,who emulates the jesters of the Middle Ages in scourging authority and upholding the dignity of the downtrodden,https://masterdataapi.nobelprize.org/2/nobelPrize/lit/1997,http://masterdataapi.nobelprize.org/2/laureate/674,71,,,Europe,0.0,0.0,0.0,0.0,42.41,12.74,48.55,5.72
1997,Chemistry,John E. Walker,male,1941-01-07,"MRC Laboratory of Molecular Biology, Cambridge, United Kingdom",Halifax,United Kingdom,for their elucidation of the enzymatic mechanism underlying the synthesis of adenosine triphosphate (ATP),https://masterdataapi.nobelprize.org/2/nobelPrize/che/1997,http://masterdataapi.nobelprize.org/2/laureate/288,56,United Kingdom,Europe,Europe,52.94,-1.23,48.55,5.72,52.94,-1.23,48.55,5.72
1997,Physics,Steven Chu,male,1948-02-28,"Stanford University, Stanford, CA, USA","St. Louis, MO",USA,for development of methods to cool and trap atoms with laser light,https://masterdataapi.nobelprize.org/2/nobelPrize/phy/1997,http://masterdataapi.nobelprize.org/2/laureate/152,49,USA,North America,North America,38.51,-100.3,38.51,-100.3,38.51,-100.3,38.51,-100.3
1997,Medicine,Stanley B. Prusiner,male,1942-05-28,"University of California School of Medicine, San Francisco, CA, USA","Des Moines, IA",USA,for his discovery of Prions - a new biological principle of infection,https://masterdataapi.nobelprize.org/2/nobelPrize/med/1997,http://masterdataapi.nobelprize.org/2/laureate/457,55,USA,North America,North America,38.51,-100.3,38.51,-100.3,38.51,-100.3,38.51,-100.3
1997,Economic Sciences,Myron Scholes,male,1941-07-01,"Long Term Capital Management, Greenwich, CT, USA","Timmins, ON",Canada,for a new method to determine the value of derivatives,https://masterdataapi.nobelprize.org/2/nobelPrize/eco/1997,http://masterdataapi.nobelprize.org/2/laureate/718,56,USA,North America,North America,38.51,-100.3,38.51,-100.3,54.98,-100.53,38.51,-100.3
1998,Literature,José Saramago,male,1922-11-16,,Azinhaga,Portugal,"who with parables sustained by imagination, compassion and irony continually enables us once again to apprehend an elusory reality",https://masterdataapi.nobelprize.org/2/nobelPrize/lit/1998,http://masterdataapi.nobelprize.org/2/laureate/675,76,,,Europe,0.0,0.0,0.0,0.0,39.76,-8.27,48.55,5.72
1998,Economic Sciences,Amartya Sen,male,1933-11-03,"Trinity College, Cambridge, United Kingdom",Santiniketan,India,for his contributions to welfare economics,https://masterdataapi.nobelprize.org/2/nobelPrize/eco/1998,http://masterdataapi.nobelprize.org/2/laureate/719,65,United Kingdom,Europe,India,52.94,-1.23,48.55,5.72,20.6,78.66,20.6,78.66
1998,Medicine,Ferid Murad,male,1936-09-14,"University of Texas Medical School at Houston, Houston, TX, USA","Whiting, IN",USA,for their discoveries concerning nitric oxide as a signalling molecule in the cardiovascular system,https://masterdataapi.nobelprize.org/2/nobelPrize/med/1998,http://masterdataapi.nobelprize.org/2/laureate/460,62,USA,North America,North America,38.51,-100.3,38.51,-100.3,38.51,-100.3,38.51,-100.3
1998,Peace,John Hume,male,1937-01-18,,Londonderry,Northern Ireland,for their efforts to find a peaceful solution to the conflict in Northern Ireland,https://masterdataapi.nobelprize.org/2/nobelPrize/pea/1998,http://masterdataapi.nobelprize.org/2/laureate/566,61,,,Northern Ireland,0.0,0.0,0.0,0.0,0.0,0.0,0.0,0.0
1998,Chemistry,John Pople,male,1925-10-31,"Northwestern University, Evanston, IL, USA",Burnham-on-Sea,United Kingdom,for his development of computational methods in quantum chemistry,https://masterdataapi.nobelprize.org/2/nobelPrize/che/1998,http://masterdataapi.nobelprize.org/2/laureate/291,73,USA,North America,Europe,38.51,-100.3,38.51,-100.3,52.94,-1.23,48.55,5.72
1998,Physics,Robert B. Laughlin,male,1950-11-01,"Stanford University, Stanford, CA, USA","Visalia, CA",USA,for their discovery of a new form of quantum fluid with fractionally charged excitations,https://masterdataapi.nobelprize.org/2/nobelPrize/phy/1998,http://masterdataapi.nobelprize.org/2/laureate/155,48,USA,North America,North America,38.51,-100.3,38.51,-100.3,38.51,-100.3,38.51,-100.3
1998,Chemistry,Walter Kohn,male,1923-03-09,"University of California, Santa Barbara, CA, USA",Vienna,Austria,for his development of the density-functional theory,https://masterdataapi.nobelprize.org/2/nobelPrize/che/1998,http://masterdataapi.nobelprize.org/2/laureate/290,75,USA,North America,Europe,38.51,-100.3,38.51,-100.3,47.35,14.47,48.55,5.72
1998,Peace,David Trimble,male,1944-10-15,,Belfast,Northern Ireland,for their efforts to find a peaceful solution to the conflict in Northern Ireland,https://masterdataapi.nobelprize.org/2/nobelPrize/pea/1998,http://masterdataapi.nobelprize.org/2/laureate/567,54,,,Northern Ireland,0.0,0.0,0.0,0.0,0.0,0.0,0.0,0.0
1998,Medicine,Louis J. Ignarro,male,1941-05-31,"University of California School of Medicine, Los Angeles, CA, USA","Brooklyn, NY",USA,for their discoveries concerning nitric oxide as a signalling molecule in the cardiovascular system,https://masterdataapi.nobelprize.org/2/nobelPrize/med/1998,http://masterdataapi.nobelprize.org/2/laureate/459,57,USA,North America,North America,38.51,-100.3,38.51,-100.3,38.51,-100.3,38.51,-100.3
1998,Physics,Horst L. Störmer,male,1949-04-06,"Columbia University, New York, NY, USA",Frankfurt-on-the-Main,Germany,for their discovery of a new form of quantum fluid with fractionally charged excitations,https://masterdataapi.nobelprize.org/2/nobelPrize/phy/1998,http://masterdataapi.nobelprize.org/2/laureate/156,49,USA,North America,Europe,38.51,-100.3,38.51,-100.3,51.42,10.6,48.55,5.72
1998,Medicine,Robert F. Furchgott,male,1916-06-04,"SUNY Health Science Center, Brooklyn, NY, USA","Charleston, SC",USA,for their discoveries concerning nitric oxide as a signalling molecule in the cardiovascular system,https://masterdataapi.nobelprize.org/2/nobelPrize/med/1998,http://masterdataapi.nobelprize.org/2/laureate/458,82,USA,North America,North America,38.51,-100.3,38.51,-100.3,38.51,-100.3,38.51,-100.3
1998,Physics,Daniel C. Tsui,male,1939-02-28,"Princeton University, Princeton, NJ, USA",Henan,China,for their discovery of a new form of quantum fluid with fractionally charged excitations,https://masterdataapi.nobelprize.org/2/nobelPrize/phy/1998,http://masterdataapi.nobelprize.org/2/laureate/157,59,USA,North America,China,38.51,-100.3,38.51,-100.3,32.87,105.22,32.87,105.22
1999,Literature,Günter Grass,male,1927-10-16,,Gdansk,Poland,whose frolicsome black fables portray the forgotten face of history,https://masterdataapi.nobelprize.org/2/nobelPrize/lit/1999,http://masterdataapi.nobelprize.org/2/laureate/676,72,,,Poland,0.0,0.0,0.0,0.0,0.0,0.0,0.0,0.0
1999,Medicine,Günter Blobel,male,1936-05-21,"Rockefeller University, New York, NY, USA",Niegoslawice,Poland,for the discovery that proteins have intrinsic signals that govern their transport and localization in the cell,https://masterdataapi.nobelprize.org/2/nobelPrize/med/1999,http://masterdataapi.nobelprize.org/2/laureate/461,63,USA,North America,Poland,38.51,-100.3,38.51,-100.3,0.0,0.0,0.0,0.0
1999,Physics,Gerardus 't Hooft,male,1946-07-05,"Utrecht University, Utrecht, the Netherlands",Den Helder,the Netherlands,for elucidating the quantum structure of electroweak interactions in physics,https://masterdataapi.nobelprize.org/2/nobelPrize/phy/1999,http://masterdataapi.nobelprize.org/2/laureate/158,53,the Netherlands,Europe,Europe,52.52,5.74,48.55,5.72,52.52,5.74,48.55,5.72
1999,Chemistry,Ahmed Zewail,male,1946-02-26,"California Institute of Technology (Caltech), Pasadena, CA, USA",Damanhur,Egypt,for his studies of the transition states of chemical reactions using femtosecond spectroscopy,https://masterdataapi.nobelprize.org/2/nobelPrize/che/1999,http://masterdataapi.nobelprize.org/2/laureate/292,53,USA,North America,Egypt,38.51,-100.3,38.51,-100.3,0.0,0.0,0.0,0.0
1999,Physics,Martinus J.G. Veltman,male,1931-06-27,,Waalwijk,the Netherlands,for elucidating the quantum structure of electroweak interactions in physics,https://masterdataapi.nobelprize.org/2/nobelPrize/phy/1999,http://masterdataapi.nobelprize.org/2/laureate/159,68,,,Europe,0.0,0.0,0.0,0.0,52.52,5.74,48.55,5.72
1999,Economic Sciences,Robert Mundell,male,1932-10-24,"Columbia University, New York, NY, USA","Kingston, ON",Canada,for his analysis of monetary and fiscal policy under different exchange rate regimes and his analysis of optimum currency areas,https://masterdataapi.nobelprize.org/2/nobelPrize/eco/1999,http://masterdataapi.nobelprize.org/2/laureate/720,67,USA,North America,North America,38.51,-100.3,38.51,-100.3,54.98,-100.53,38.51,-100.3
2000,Medicine,Paul Greengard,male,1925-12-11,"Rockefeller University, New York, NY, USA","New York, NY",USA,for their discoveries concerning signal transduction in the nervous system,https://masterdataapi.nobelprize.org/2/nobelPrize/med/2000,http://masterdataapi.nobelprize.org/2/laureate/723,75,USA,North America,North America,38.51,-100.3,38.51,-100.3,38.51,-100.3,38.51,-100.3
2000,Physics,Zhores Alferov,male,1930-03-15,"A.F. Ioffe Physico-Technical Institute, St. Petersburg, Russia","Vitebsk, Belorussia",Belarus,for developing semiconductor heterostructures used in high-speed- and opto-electronics,https://masterdataapi.nobelprize.org/2/nobelPrize/phy/2000,http://masterdataapi.nobelprize.org/2/laureate/726,70,Russia,Russia,Belarus,61.1,81.38,61.1,81.38,0.0,0.0,0.0,0.0
2000,Physics,Jack Kilby,male,1923-11-08,"Texas Instruments, Dallas, TX, USA","Jefferson City, MO",USA,for his part in the invention of the integrated circuit,https://masterdataapi.nobelprize.org/2/nobelPrize/phy/2000,http://masterdataapi.nobelprize.org/2/laureate/728,77,USA,North America,North America,38.51,-100.3,38.51,-100.3,38.51,-100.3,38.51,-100.3
2000,Medicine,Eric Kandel,male,1929-11-07,"Columbia University, New York, NY, USA",Vienna,Austria,for their discoveries concerning signal transduction in the nervous system,https://masterdataapi.nobelprize.org/2/nobelPrize/med/2000,http://masterdataapi.nobelprize.org/2/laureate/724,71,USA,North America,Europe,38.51,-100.3,38.51,-100.3,47.35,14.47,48.55,5.72
2000,Economic Sciences,James J. Heckman,male,1944-04-19,"University of Chicago, Chicago, IL, USA","Chicago, IL",USA,for his development of theory and methods for analyzing selective samples,https://masterdataapi.nobelprize.org/2/nobelPrize/eco/2000,http://masterdataapi.nobelprize.org/2/laureate/732,56,USA,North America,North America,38.51,-100.3,38.51,-100.3,38.51,-100.3,38.51,-100.3
2000,Physics,Herbert Kroemer,male,1928-08-25,"University of California, Santa Barbara, CA, USA",Weimar,Germany,for developing semiconductor heterostructures used in high-speed- and opto-electronics,https://masterdataapi.nobelprize.org/2/nobelPrize/phy/2000,http://masterdataapi.nobelprize.org/2/laureate/727,72,USA,North America,Europe,38.51,-100.3,38.51,-100.3,51.42,10.6,48.55,5.72
2000,Literature,Gao Xingjian,male,1940-01-04,,Ganzhou,China,"for an &aelig;uvre of universal validity, bitter insights and linguistic ingenuity, which has opened new paths for the Chinese novel and drama",https://masterdataapi.nobelprize.org/2/nobelPrize/lit/2000,http://masterdataapi.nobelprize.org/2/laureate/734,60,,,China,0.0,0.0,0.0,0.0,32.87,105.22,32.87,105.22
2000,Economic Sciences,Daniel L. McFadden,male,1937-07-29,"University of California, Berkeley, CA, USA","Raleigh, NC",USA,for his development of theory and methods for analyzing discrete choice,https://masterdataapi.nobelprize.org/2/nobelPrize/eco/2000,http://masterdataapi.nobelprize.org/2/laureate/733,63,USA,North America,North America,38.51,-100.3,38.51,-100.3,38.51,-100.3,38.51,-100.3
2000,Chemistry,Alan Heeger,male,1936-01-22,"University of California, Santa Barbara, CA, USA","Sioux City, IA",USA,for the discovery and development of conductive polymers,https://masterdataapi.nobelprize.org/2/nobelPrize/che/2000,http://masterdataapi.nobelprize.org/2/laureate/729,64,USA,North America,North America,38.51,-100.3,38.51,-100.3,38.51,-100.3,38.51,-100.3
2000,Peace,Kim Dae-jung,male,1925-12-03,,Mokpo,South Korea,"for his work for democracy and human rights in South Korea and in East Asia in general, and for peace and reconciliation with North Korea in particular",https://masterdataapi.nobelprize.org/2/nobelPrize/pea/2000,http://masterdataapi.nobelprize.org/2/laureate/725,75,,,South Korea,0.0,0.0,0.0,0.0,0.0,0.0,0.0,0.0
2000,Medicine,Arvid Carlsson,male,1923-01-25,"Göteborg University, Gothenburg, Sweden",Uppsala,Sweden,for their discoveries concerning signal transduction in the nervous system,https://masterdataapi.nobelprize.org/2/nobelPrize/med/2000,http://masterdataapi.nobelprize.org/2/laureate/722,77,Sweden,Europe,Europe,60.8,15.21,48.55,5.72,60.8,15.21,48.55,5.72
2000,Chemistry,Hideki Shirakawa,male,1936-08-20,"University of Tsukuba, Tokyo, Japan",Tokyo,Japan,for the discovery and development of conductive polymers,https://masterdataapi.nobelprize.org/2/nobelPrize/che/2000,http://masterdataapi.nobelprize.org/2/laureate/731,64,Japan,Japan,Japan,36.98,139.59,36.98,139.59,36.98,139.59,36.98,139.59
2000,Chemistry,Alan MacDiarmid,male,1927-04-14,"University of Pennsylvania, Philadelphia, PA, USA",Masterton,New Zealand,for the discovery and development of conductive polymers,https://masterdataapi.nobelprize.org/2/nobelPrize/che/2000,http://masterdataapi.nobelprize.org/2/laureate/730,73,USA,North America,New Zealand,38.51,-100.3,38.51,-100.3,0.0,0.0,0.0,0.0
2001,Chemistry,William Knowles,male,1917-06-01,,"Taunton, MA",USA,for their work on chirally catalysed hydrogenation reactions,https://masterdataapi.nobelprize.org/2/nobelPrize/che/2001,http://masterdataapi.nobelprize.org/2/laureate/741,84,,,North America,0.0,0.0,0.0,0.0,38.51,-100.3,38.51,-100.3
2001,Literature,V. S. Naipaul,male,1932-08-17,,Chaguanas,Trinidad and Tobago,for having united perceptive narrative and incorruptible scrutiny in works that compel us to see the presence of suppressed histories,https://masterdataapi.nobelprize.org/2/nobelPrize/lit/2001,http://masterdataapi.nobelprize.org/2/laureate/747,69,,,Trinidad and Tobago,0.0,0.0,0.0,0.0,0.0,0.0,0.0,0.0
2001,Medicine,Sir Paul Nurse,male,1949-01-25,"Imperial Cancer Research Fund, London, United Kingdom",Norwich,United Kingdom,for their discoveries of key regulators of the cell cycle,https://masterdataapi.nobelprize.org/2/nobelPrize/med/2001,http://masterdataapi.nobelprize.org/2/laureate/737,52,United Kingdom,Europe,Europe,52.94,-1.23,48.55,5.72,52.94,-1.23,48.55,5.72
2001,Medicine,Tim Hunt,male,1943-02-19,"Imperial Cancer Research Fund, London, United Kingdom",Neston,United Kingdom,for their discoveries of key regulators of the cell cycle,https://masterdataapi.nobelprize.org/2/nobelPrize/med/2001,http://masterdataapi.nobelprize.org/2/laureate/736,58,United Kingdom,Europe,Europe,52.94,-1.23,48.55,5.72,52.94,-1.23,48.55,5.72
2001,Physics,Wolfgang Ketterle,male,1957-10-21,"Massachusetts Institute of Technology (MIT), Cambridge, MA, USA",Heidelberg,Germany,"for the achievement of Bose-Einstein condensation in dilute gases of alkali atoms, and for early fundamental studies of the properties of the condensates",https://masterdataapi.nobelprize.org/2/nobelPrize/phy/2001,http://masterdataapi.nobelprize.org/2/laureate/739,44,USA,North America,Europe,38.51,-100.3,38.51,-100.3,51.42,10.6,48.55,5.72
2001,Chemistry,Ryoji Noyori,male,1938-09-03,"Nagoya University, Nagoya, Japan",Kobe,Japan,for their work on chirally catalysed hydrogenation reactions,https://masterdataapi.nobelprize.org/2/nobelPrize/che/2001,http://masterdataapi.nobelprize.org/2/laureate/742,63,Japan,Japan,Japan,36.98,139.59,36.98,139.59,36.98,139.59,36.98,139.59
2001,Economic Sciences,A. Michael Spence,male,1943-00-00,"Stanford University, Stanford, CA, USA","Montclair, NJ",USA,for their analyses of markets with asymmetric information,https://masterdataapi.nobelprize.org/2/nobelPrize/eco/2001,http://masterdataapi.nobelprize.org/2/laureate/745,58,USA,North America,North America,38.51,-100.3,38.51,-100.3,38.51,-100.3,38.51,-100.3
2001,Peace,Kofi Annan,male,1938-04-08,,Kumasi,Ghana,for their work for a better organized and more peaceful world,https://masterdataapi.nobelprize.org/2/nobelPrize/pea/2001,http://masterdataapi.nobelprize.org/2/laureate/749,63,,,Ghana,0.0,0.0,0.0,0.0,0.0,0.0,0.0,0.0
2001,Chemistry,Barry Sharpless,male,1941-04-28,"The Scripps Research Institute, La Jolla, CA, USA","Philadelphia, PA",USA,for his work on chirally catalysed oxidation reactions,https://masterdataapi.nobelprize.org/2/nobelPrize/che/2001,http://masterdataapi.nobelprize.org/2/laureate/743,60,USA,North America,North America,38.51,-100.3,38.51,-100.3,38.51,-100.3,38.51,-100.3
2001,Economic Sciences,Joseph E. Stiglitz,male,1943-02-09,"Columbia University, New York, NY, USA","Gary, IN",USA,for their analyses of markets with asymmetric information,https://masterdataapi.nobelprize.org/2/nobelPrize/eco/2001,http://masterdataapi.nobelprize.org/2/laureate/746,58,USA,North America,North America,38.51,-100.3,38.51,-100.3,38.51,-100.3,38.51,-100.3
2001,Medicine,Leland Hartwell,male,1939-10-30,"Fred Hutchinson Cancer Research Center, Seattle, WA, USA","Los Angeles, CA",USA,for their discoveries of key regulators of the cell cycle,https://masterdataapi.nobelprize.org/2/nobelPrize/med/2001,http://masterdataapi.nobelprize.org/2/laureate/735,62,USA,North America,North America,38.51,-100.3,38.51,-100.3,38.51,-100.3,38.51,-100.3
2001,Physics,Carl Wieman,male,1951-03-26,"University of Colorado, JILA, Boulder, CO, USA","Corvallis, OR",USA,"for the achievement of Bose-Einstein condensation in dilute gases of alkali atoms, and for early fundamental studies of the properties of the condensates",https://masterdataapi.nobelprize.org/2/nobelPrize/phy/2001,http://masterdataapi.nobelprize.org/2/laureate/740,50,USA,North America,North America,38.51,-100.3,38.51,-100.3,38.51,-100.3,38.51,-100.3
2001,Economic Sciences,George A. Akerlof,male,1940-06-17,"University of California, Berkeley, CA, USA","New Haven, CT",USA,for their analyses of markets with asymmetric information,https://masterdataapi.nobelprize.org/2/nobelPrize/eco/2001,http://masterdataapi.nobelprize.org/2/laureate/744,61,USA,North America,North America,38.51,-100.3,38.51,-100.3,38.51,-100.3,38.51,-100.3
2001,Physics,Eric Cornell,male,1961-12-19,"University of Colorado, JILA, Boulder, CO, USA","Palo Alto, CA",USA,"for the achievement of Bose-Einstein condensation in dilute gases of alkali atoms, and for early fundamental studies of the properties of the condensates",https://masterdataapi.nobelprize.org/2/nobelPrize/phy/2001,http://masterdataapi.nobelprize.org/2/laureate/738,40,USA,North America,North America,38.51,-100.3,38.51,-100.3,38.51,-100.3,38.51,-100.3
2002,Medicine,Sydney Brenner,male,1927-01-13,"The Molecular Sciences Institute, Berkeley, CA, USA",Germiston,South Africa,for their discoveries concerning genetic regulation of organ development and programmed cell death',https://masterdataapi.nobelprize.org/2/nobelPrize/med/2002,http://masterdataapi.nobelprize.org/2/laureate/750,75,USA,North America,South Africa,38.51,-100.3,38.51,-100.3,0.0,0.0,0.0,0.0
2002,Economic Sciences,Daniel Kahneman,male,1934-03-05,"Princeton University, Princeton, NJ, USA",Tel Aviv,Israel,"for having integrated insights from psychological research into economic science, especially concerning human judgment and decision-making under uncertainty",https://masterdataapi.nobelprize.org/2/nobelPrize/eco/2002,http://masterdataapi.nobelprize.org/2/laureate/759,68,USA,North America,Israel,38.51,-100.3,38.51,-100.3,31.51,34.93,31.51,34.93
2002,Peace,Jimmy Carter,male,1924-10-01,,"Plains, GA",USA,"for his decades of untiring effort to find peaceful solutions to international conflicts, to advance democracy and human rights, and to promote economic and social development",https://masterdataapi.nobelprize.org/2/nobelPrize/pea/2002,http://masterdataapi.nobelprize.org/2/laureate/762,78,,,North America,0.0,0.0,0.0,0.0,38.51,-100.3,38.51,-100.3
2002,Chemistry,John B. Fenn,male,1917-06-15,"Virginia Commonwealth University, Richmond, VA, USA","New York, NY",USA,for their development of soft desorption ionisation methods for mass spectrometric analyses of biological macromolecules,https://masterdataapi.nobelprize.org/2/nobelPrize/che/2002,http://masterdataapi.nobelprize.org/2/laureate/756,85,USA,North America,North America,38.51,-100.3,38.51,-100.3,38.51,-100.3,38.51,-100.3
2002,Medicine,John E. Sulston,male,1942-03-27,"The Wellcome Trust Sanger Institute, Cambridge, United Kingdom",Cambridge,United Kingdom,for their discoveries concerning genetic regulation of organ development and programmed cell death',https://masterdataapi.nobelprize.org/2/nobelPrize/med/2002,http://masterdataapi.nobelprize.org/2/laureate/752,60,United Kingdom,Europe,Europe,52.94,-1.23,48.55,5.72,52.94,-1.23,48.55,5.72
2002,Economic Sciences,Vernon L. Smith,male,1927-01-01,"George Mason University, Fairfax, VA, USA","Wichita, KS",USA,"for having established laboratory experiments as a tool in empirical economic analysis, especially in the study of alternative market mechanisms",https://masterdataapi.nobelprize.org/2/nobelPrize/eco/2002,http://masterdataapi.nobelprize.org/2/laureate/760,75,USA,North America,North America,38.51,-100.3,38.51,-100.3,38.51,-100.3,38.51,-100.3
2002,Chemistry,Koichi Tanaka,male,1959-08-03,"Shimadzu Corp., Kyoto, Japan",Toyama City,Japan,for their development of soft desorption ionisation methods for mass spectrometric analyses of biological macromolecules,https://masterdataapi.nobelprize.org/2/nobelPrize/che/2002,http://masterdataapi.nobelprize.org/2/laureate/757,43,Japan,Japan,Japan,36.98,139.59,36.98,139.59,36.98,139.59,36.98,139.59
2002,Chemistry,Kurt Wüthrich,male,1938-10-04,"Eidgenössische Technische Hochschule (Swiss Federal Institute of Technology), Zurich, Switzerland",Aarberg,Switzerland,for his development of nuclear magnetic resonance spectroscopy for determining the three-dimensional structure of biological macromolecules in solution,https://masterdataapi.nobelprize.org/2/nobelPrize/che/2002,http://masterdataapi.nobelprize.org/2/laureate/758,64,Switzerland,Europe,Europe,47.0,8.43,48.55,5.72,47.0,8.43,48.55,5.72
2002,Medicine,H. Robert Horvitz,male,1947-05-08,"Massachusetts Institute of Technology (MIT), Cambridge, MA, USA","Chicago, IL",USA,for their discoveries concerning genetic regulation of organ development and programmed cell death',https://masterdataapi.nobelprize.org/2/nobelPrize/med/2002,http://masterdataapi.nobelprize.org/2/laureate/751,55,USA,North America,North America,38.51,-100.3,38.51,-100.3,38.51,-100.3,38.51,-100.3
2002,Physics,Masatoshi Koshiba,male,1926-09-19,"University of Tokyo, Tokyo, Japan",Toyohashi,Japan,"for pioneering contributions to astrophysics, in particular for the detection of cosmic neutrinos",https://masterdataapi.nobelprize.org/2/nobelPrize/phy/2002,http://masterdataapi.nobelprize.org/2/laureate/754,76,Japan,Japan,Japan,36.98,139.59,36.98,139.59,36.98,139.59,36.98,139.59
2002,Literature,Imre Kertész,male,1929-11-09,,Budapest,Hungary,for writing that upholds the fragile experience of the individual against the barbaric arbitrariness of history,https://masterdataapi.nobelprize.org/2/nobelPrize/lit/2002,http://masterdataapi.nobelprize.org/2/laureate/761,73,,,Europe,0.0,0.0,0.0,0.0,46.66,18.98,48.55,5.72
