awardYear,category,name,gender,birth_date,affiliation_1,birth_cityNow,birth_countryNow,motivation,award_link,laureate_link,age,affiliation_country,affiliation_zone,birth_zone,affiliation_lat,affiliation_lon,affiliation_zone_lat,affiliation_zone_lon,birth_lat,birth_lon,birth_zone_lat,birth_zone_lon
1971,Economic Sciences,Simon Kuznets,male,1901-04-30,"Harvard University, Cambridge, MA, USA",Pinsk,Belarus,for his empirically founded interpretation of economic growth which has led to new and deepened insight into the economic and social structure and process of development,https://masterdataapi.nobelprize.org/2/nobelPrize/eco/1971,http://masterdataapi.nobelprize.org/2/laureate/680,70,USA,North America,Belarus,38.51,-100.3,38.51,-100.3,0.0,0.0,0.0,0.0
1971,Physics,Dennis Gabor,male,1900-06-05,"Imperial College, London, United Kingdom",Budapest,Hungary,for his invention and development of the holographic method,https://masterdataapi.nobelprize.org/2/nobelPrize/phy/1971,http://masterdataapi.nobelprize.org/2/laureate/93,71,United Kingdom,Europe,Europe,52.94,-1.23,48.55,5.72,46.66,18.98,48.55,5.72
1971,Literature,Pablo Neruda,male,1904-07-12,,Parral,Chile,for a poetry that with the action of an elemental force brings alive a continent's destiny and dreams,https://masterdataapi.nobelprize.org/2/nobelPrize/lit/1971,http://masterdataapi.nobelprize.org/2/laureate/645,67,,,Chile,0.0,0.0,0.0,0.0,0.0,0.0,0.0,0.0
1971,Peace,Willy Brandt,male,1913-12-18,,Lübeck,Germany,for paving the way for a meaningful dialogue between East and West,https://masterdataapi.nobelprize.org/2/nobelPrize/pea/1971,http://masterdataapi.nobelprize.org/2/laureate/529,58,,,Europe,0.0,0.0,0.0,0.0,51.42,10.6,48.55,5.72
1971,Medicine,"Earl W. Sutherland, Jr.",male,1915-11-19,"Vanderbilt University, Nashville, TN, USA","Burlingame, KS",USA,for his discoveries concerning the mechanisms of the action of hormones,https://masterdataapi.nobelprize.org/2/nobelPrize/med/1971,http://masterdataapi.nobelprize.org/2/laureate/397,56,USA,North America,North America,38.51,-100.3,38.51,-100.3,38.51,-100.3,38.51,-100.3
1972,Physics,John Bardeen,male,1908-05-23,"University of Illinois, Urbana, IL, USA","Madison, WI",USA,"for their jointly developed theory of superconductivity, usually called the BCS-theory",https://masterdataapi.nobelprize.org/2/nobelPrize/phy/1972,http://masterdataapi.nobelprize.org/2/laureate/66,64,USA,North America,North America,38.51,-100.3,38.51,-100.3,38.51,-100.3,38.51,-100.3
1972,Economic Sciences,Kenneth J. Arrow,male,1921-08-23,"Harvard University, Cambridge, MA, USA","New York, NY",USA,for their pioneering contributions to general economic equilibrium theory and welfare theory,https://masterdataapi.nobelprize.org/2/nobelPrize/eco/1972,http://masterdataapi.nobelprize.org/2/laureate/682,51,USA,North America,North America,38.51,-100.3,38.51,-100.3,38.51,-100.3,38.51,-100.3
1972,Literature,Heinrich Böll,male,1917-12-21,,Cologne,Germany,for his writing which through its combination of a broad perspective on his time and a sensitive skill in characterization has contributed to a renewal of German literature,https://masterdataapi.nobelprize.org/2/nobelPrize/lit/1972,http://masterdataapi.nobelprize.org/2/laureate/647,55,,,Europe,0.0,0.0,0.0,0.0,51.42,10.6,48.55,5.72
1972,Economic Sciences,John R. Hicks,male,1904-04-08,"All Souls College, Oxford, United Kingdom",Warwick,United Kingdom,for their pioneering contributions to general economic equilibrium theory and welfare theory,https://masterdataapi.nobelprize.org/2/nobelPrize/eco/1972,http://masterdataapi.nobelprize.org/2/laureate/681,68,United Kingdom,Europe,Europe,52.94,-1.23,48.55,5.72,52.94,-1.23,48.55,5.72
1972,Chemistry,Christian Anfinsen,male,1916-03-26,"National Institutes of Health, Bethesda, MD, USA","Monessen, PA",USA,"for his work on ribonuclease, especially concerning the connection between the amino acid sequence and the biologically active conformation",https://masterdataapi.nobelprize.org/2/nobelPrize/che/1972,http://masterdataapi.nobelprize.org/2/laureate/241,56,USA,North America,North America,38.51,-100.3,38.51,-100.3,38.51,-100.3,38.51,-100.3
1972,Chemistry,Stanford Moore,male,1913-09-04,"Rockefeller University, New York, NY, USA","Chicago, IL",USA,for their contribution to the understanding of the connection between chemical structure and catalytic activity of the active centre of the ribonuclease molecule,https://masterdataapi.nobelprize.org/2/nobelPrize/che/1972,http://masterdataapi.nobelprize.org/2/laureate/242,59,USA,North America,North America,38.51,-100.3,38.51,-100.3,38.51,-100.3,38.51,-100.3
1972,Medicine,Rodney R. Porter,male,1917-10-08,"University of Oxford, Oxford, United Kingdom",Newton-le-Willows,United Kingdom,for their discoveries concerning the chemical structure of antibodies,https://masterdataapi.nobelprize.org/2/nobelPrize/med/1972,http://masterdataapi.nobelprize.org/2/laureate/399,55,United Kingdom,Europe,Europe,52.94,-1.23,48.55,5.72,52.94,-1.23,48.55,5.72
1972,Medicine,Gerald M. Edelman,male,1929-07-01,"Rockefeller University, New York, NY, USA","New York, NY",USA,for their discoveries concerning the chemical structure of antibodies,https://masterdataapi.nobelprize.org/2/nobelPrize/med/1972,http://masterdataapi.nobelprize.org/2/laureate/398,43,USA,North America,North America,38.51,-100.3,38.51,-100.3,38.51,-100.3,38.51,-100.3
1972,Physics,Leon N. Cooper,male,1930-02-28,"Brown University, Providence, RI, USA","New York, NY",USA,"for their jointly developed theory of superconductivity, usually called the BCS-theory",https://masterdataapi.nobelprize.org/2/nobelPrize/phy/1972,http://masterdataapi.nobelprize.org/2/laureate/95,42,USA,North America,North America,38.51,-100.3,38.51,-100.3,38.51,-100.3,38.51,-100.3
1972,Chemistry,William H. Stein,male,1911-06-25,"Rockefeller University, New York, NY, USA","New York, NY",USA,for their contribution to the understanding of the connection between chemical structure and catalytic activity of the active centre of the ribonuclease molecule,https://masterdataapi.nobelprize.org/2/nobelPrize/che/1972,http://masterdataapi.nobelprize.org/2/laureate/243,61,USA,North America,North America,38.51,-100.3,38.51,-100.3,38.51,-100.3,38.51,-100.3
1972,Physics,Robert Schrieffer,male,1931-05-31,"University of Pennsylvania, Philadelphia, PA, USA","Oak Park, IL",USA,"for their jointly developed theory of superconductivity, usually called the BCS-theory",https://masterdataapi.nobelprize.org/2/nobelPrize/phy/1972,http://masterdataapi.nobelprize.org/2/laureate/96,41,USA,North America,North America,38.51,-100.3,38.51,-100.3,38.51,-100.3,38.51,-100.3
1973,Physics,Brian D. Josephson,male,1940-01-04,"University of Cambridge, Cambridge, United Kingdom",Cardiff,United Kingdom,"for his theoretical predictions of the properties of a supercurrent through a tunnel barrier, in particular those phenomena which are generally known as the Josephson effects",https://masterdataapi.nobelprize.org/2/nobelPrize/phy/1973,http://masterdataapi.nobelprize.org/2/laureate/99,33,United Kingdom,Europe,Europe,52.94,-1.23,48.55,5.72,52.94,-1.23,48.55,5.72
1973,Chemistry,Ernst Otto Fischer,male,1918-11-10,"Technical University, Munich, Germany",Munich,Germany,"for their pioneering work, performed independently, on the chemistry of the organometallic, so called sandwich compounds",https://masterdataapi.nobelprize.org/2/nobelPrize/che/1973,http://masterdataapi.nobelprize.org/2/laureate/244,55,Germany,Europe,Europe,51.42,10.6,48.55,5.72,51.42,10.6,48.55,5.72
1973,Economic Sciences,Wassily Leontief,male,1906-08-05,"Harvard University, Cambridge, MA, USA",St. Petersburg,Russia,for the development of the input-output method and for its application to important economic problems,https://masterdataapi.nobelprize.org/2/nobelPrize/eco/1973,http://masterdataapi.nobelprize.org/2/laureate/683,67,USA,North America,Russia,38.51,-100.3,38.51,-100.3,61.1,81.38,61.1,81.38
1973,Chemistry,Geoffrey Wilkinson,male,1921-07-14,"Imperial College, London, United Kingdom",Todmorden,United Kingdom,"for their pioneering work, performed independently, on the chemistry of the organometallic, so called sandwich compounds",https://masterdataapi.nobelprize.org/2/nobelPrize/che/1973,http://masterdataapi.nobelprize.org/2/laureate/245,52,United Kingdom,Europe,Europe,52.94,-1.23,48.55,5.72,52.94,-1.23,48.55,5.72
1973,Literature,Patrick White,male,1912-05-28,,London,United Kingdom,for an epic and psychological narrative art which has introduced a new continent into literature,https://masterdataapi.nobelprize.org/2/nobelPrize/lit/1973,http://masterdataapi.nobelprize.org/2/laureate/648,61,,,Europe,0.0,0.0,0.0,0.0,52.94,-1.23,48.55,5.72
1973,Medicine,Karl von Frisch,male,1886-11-20,"Zoologisches Institut der Universität München, Munich, Germany",Vienna,Austria,for their discoveries concerning organization and elicitation of individual and social behaviour patterns,https://masterdataapi.nobelprize.org/2/nobelPrize/med/1973,http://masterdataapi.nobelprize.org/2/laureate/400,87,Germany,Europe,Europe,51.42,10.6,48.55,5.72,47.35,14.47,48.55,5.72
1973,Medicine,Nikolaas Tinbergen,male,1907-04-15,"University of Oxford, Oxford, United Kingdom",the Hague,the Netherlands,for their discoveries concerning organization and elicitation of individual and social behaviour patterns,https://masterdataapi.nobelprize.org/2/nobelPrize/med/1973,http://masterdataapi.nobelprize.org/2/laureate/402,66,United Kingdom,Europe,Europe,52.94,-1.23,48.55,5.72,52.52,5.74,48.55,5.72
1973,Peace,Henry Kissinger,male,1923-05-27,,Fürth,Germany,for jointly having negotiated a cease fire in Vietnam in 1973,https://masterdataapi.nobelprize.org/2/nobelPrize/pea/1973,http://masterdataapi.nobelprize.org/2/laureate/530,50,,,Europe,0.0,0.0,0.0,0.0,51.42,10.6,48.55,5.72
1973,Physics,Ivar Giaever,male,1929-04-05,"General Electric Company, Schenectady, NY, USA",Bergen,Norway,"for their experimental discoveries regarding tunneling phenomena in semiconductors and superconductors, respectively",https://masterdataapi.nobelprize.org/2/nobelPrize/phy/1973,http://masterdataapi.nobelprize.org/2/laureate/98,44,USA,North America,Europe,38.51,-100.3,38.51,-100.3,61.19,8.66,48.55,5.72
1973,Physics,Leo Esaki,male,1925-03-12,"IBM Thomas J. Watson Research Center, Yorktown Heights, NY, USA",Osaka,Japan,"for their experimental discoveries regarding tunneling phenomena in semiconductors and superconductors, respectively",https://masterdataapi.nobelprize.org/2/nobelPrize/phy/1973,http://masterdataapi.nobelprize.org/2/laureate/97,48,USA,North America,Japan,38.51,-100.3,38.51,-100.3,36.98,139.59,36.98,139.59
1973,Peace,Le Duc Tho ,male,1911-10-14,,Nam Ha province,Vietnam,for jointly having negotiated a cease fire in Vietnam in 1973,https://masterdataapi.nobelprize.org/2/nobelPrize/pea/1973,http://masterdataapi.nobelprize.org/2/laureate/531,62,,,Vietnam,0.0,0.0,0.0,0.0,0.0,0.0,0.0,0.0
1973,Medicine,Konrad Lorenz,male,1903-11-07,"Konrad-Lorenz-Institut der Österreichischen Akademie der Wissen­schaften, Forschungsstelle für Ethologie, Altenberg; Grünau im Almtal, Austria",Vienna,Austria,for their discoveries concerning organization and elicitation of individual and social behaviour patterns,https://masterdataapi.nobelprize.org/2/nobelPrize/med/1973,http://masterdataapi.nobelprize.org/2/laureate/401,70,Austria,Europe,Europe,47.35,14.47,48.55,5.72,47.35,14.47,48.55,5.72
1974,Medicine,Albert Claude,male,1898-08-24,"Université Catholique de Louvain, Louvain, Belgium",Longlier,Belgium,for their discoveries concerning the structural and functional organization of the cell,https://masterdataapi.nobelprize.org/2/nobelPrize/med/1974,http://masterdataapi.nobelprize.org/2/laureate/403,76,Belgium,Europe,Europe,50.67,4.86,48.55,5.72,50.67,4.86,48.55,5.72
1974,Economic Sciences,Gunnar Myrdal,male,1898-12-06,,Skattungbyn,Sweden,"for their pioneering work in the theory of money and economic fluctuations and for their penetrating analysis of the interdependence of economic, social and institutional phenomena",https://masterdataapi.nobelprize.org/2/nobelPrize/eco/1974,http://masterdataapi.nobelprize.org/2/laureate/684,76,,,Europe,0.0,0.0,0.0,0.0,60.8,15.21,48.55,5.72
1974,Physics,Antony Hewish,male,1924-05-11,"University of Cambridge, Cambridge, United Kingdom",Fowey,United Kingdom,"for their pioneering research in radio astrophysics: Ryle for his observations and inventions, in particular of the aperture synthesis technique, and Hewish for his decisive role in the discovery of pulsars",https://masterdataapi.nobelprize.org/2/nobelPrize/phy/1974,http://masterdataapi.nobelprize.org/2/laureate/101,50,United Kingdom,Europe,Europe,52.94,-1.23,48.55,5.72,52.94,-1.23,48.55,5.72
1974,Peace,Eisaku Sato,male,1901-03-27,,Tabuse,Japan,for his contribution to stabilize conditions in the Pacific rim area and for signing the Nuclear Non-Proliferation Treaty,https://masterdataapi.nobelprize.org/2/nobelPrize/pea/1974,http://masterdataapi.nobelprize.org/2/laureate/533,73,,,Japan,0.0,0.0,0.0,0.0,36.98,139.59,36.98,139.59
1974,Medicine,George E. Palade,male,1912-11-19,"Yale University, School of Medicine, New Haven, CT, USA",Lasi,Romania,for their discoveries concerning the structural and functional organization of the cell,https://masterdataapi.nobelprize.org/2/nobelPrize/med/1974,http://masterdataapi.nobelprize.org/2/laureate/405,62,USA,North America,Romania,38.51,-100.3,38.51,-100.3,0.0,0.0,0.0,0.0
1974,Economic Sciences,Friedrich von Hayek,male,1899-05-08,,Vienna,Austria,"for their pioneering work in the theory of money and economic fluctuations and for their penetrating analysis of the interdependence of economic, social and institutional phenomena",https://masterdataapi.nobelprize.org/2/nobelPrize/eco/1974,http://masterdataapi.nobelprize.org/2/laureate/685,75,,,Europe,0.0,0.0,0.0,0.0,47.35,14.47,48.55,5.72
1974,Chemistry,Paul J. Flory,male,1910-06-19,"Stanford University, Stanford, CA, USA","Sterling, IL",USA,"for his fundamental achievements, both theoretical and experimental, in the physical chemistry of the macromolecules",https://masterdataapi.nobelprize.org/2/nobelPrize/che/1974,http://masterdataapi.nobelprize.org/2/laureate/246,64,USA,North America,North America,38.51,-100.3,38.51,-100.3,38.51,-100.3,38.51,-100.3
1974,Literature,Harry Martinson,male,1904-05-06,,Jämshög,Sweden,for writings that catch the dewdrop and reflect the cosmos,https://masterdataapi.nobelprize.org/2/nobelPrize/lit/1974,http://masterdataapi.nobelprize.org/2/laureate/650,70,,,Europe,0.0,0.0,0.0,0.0,60.8,15.21,48.55,5.72
1974,Peace,Seán MacBride,male,1904-01-26,,Paris,France,for his efforts to secure and develop human rights throughout the world,https://masterdataapi.nobelprize.org/2/nobelPrize/pea/1974,http://masterdataapi.nobelprize.org/2/laureate/532,70,,,Europe,0.0,0.0,0.0,0.0,46.97,2.7,48.55,5.72
1974,Physics,Martin Ryle,male,1918-09-27,"University of Cambridge, Cambridge, United Kingdom",Brighton,United Kingdom,"for their pioneering research in radio astrophysics: Ryle for his observations and inventions, in particular of the aperture synthesis technique, and Hewish for his decisive role in the discovery of pulsars",https://masterdataapi.nobelprize.org/2/nobelPrize/phy/1974,http://masterdataapi.nobelprize.org/2/laureate/100,56,United Kingdom,Europe,Europe,52.94,-1.23,48.55,5.72,52.94,-1.23,48.55,5.72
1974,Medicine,Christian de Duve,male,1917-10-02,"Rockefeller University, New York, NY, USA",Thames Ditton,United Kingdom,for their discoveries concerning the structural and functional organization of the cell,https://masterdataapi.nobelprize.org/2/nobelPrize/med/1974,http://masterdataapi.nobelprize.org/2/laureate/404,57,USA,North America,Europe,38.51,-100.3,38.51,-100.3,52.94,-1.23,48.55,5.72
1974,Literature,Eyvind Johnson,male,1900-07-29,,Svartbjörnsbyn,Sweden,"for a narrative art, far-seeing in lands and ages, in the service of freedom",https://masterdataapi.nobelprize.org/2/nobelPrize/lit/1974,http://masterdataapi.nobelprize.org/2/laureate/649,74,,,Europe,0.0,0.0,0.0,0.0,60.8,15.21,48.55,5.72
1975,Medicine,Howard M. Temin,male,1934-12-10,"University of Wisconsin, Madison, WI, USA","Philadelphia, PA",USA,for their discoveries concerning the interaction between tumour viruses and the genetic material of the cell,https://masterdataapi.nobelprize.org/2/nobelPrize/med/1975,http://masterdataapi.nobelprize.org/2/laureate/408,41,USA,North America,North America,38.51,-100.3,38.51,-100.3,38.51,-100.3,38.51,-100.3
1975,Physics,Ben R. Mottelson,male,1926-07-09,"Nordita, Copenhagen, Denmark","Chicago, IL",USA,for the discovery of the connection between collective motion and particle motion in atomic nuclei and the development of the theory of the structure of the atomic nucleus based on this connection,https://masterdataapi.nobelprize.org/2/nobelPrize/phy/1975,http://masterdataapi.nobelprize.org/2/laureate/103,49,Denmark,Europe,North America,56.31,9.69,48.55,5.72,38.51,-100.3,38.51,-100.3
1975,Economic Sciences,Leonid Vitaliyevich Kantorovich,male,1912-01-19,"Academy of Sciences, Moscow, USSR (now Russia)",St. Petersburg,Russia,for their contributions to the theory of optimum allocation of resources,https://masterdataapi.nobelprize.org/2/nobelPrize/eco/1975,http://masterdataapi.nobelprize.org/2/laureate/686,63,Russia,Russia,Russia,61.1,81.38,61.1,81.38,61.1,81.38,61.1,81.38
1975,Chemistry,John Cornforth,male,1917-09-07,"University of Sussex, Brighton, United Kingdom",Sydney,Australia,for his work on the stereochemistry of enzyme-catalyzed reactions,https://masterdataapi.nobelprize.org/2/nobelPrize/che/1975,http://masterdataapi.nobelprize.org/2/laureate/247,58,United Kingdom,Europe,Australia,52.94,-1.23,48.55,5.72,-26.32,134.63,-26.32,134.63
1975,Economic Sciences,Tjalling C. Koopmans,male,1910-08-28,"Yale University, New Haven, CT, USA",'s Graveland,the Netherlands,for their contributions to the theory of optimum allocation of resources,https://masterdataapi.nobelprize.org/2/nobelPrize/eco/1975,http://masterdataapi.nobelprize.org/2/laureate/687,65,USA,North America,Europe,38.51,-100.3,38.51,-100.3,52.52,5.74,48.55,5.72
1975,Chemistry,Vladimir Prelog,male,1906-07-23,"Eidgenössische Technische Hochschule (Swiss Federal Institute of Technology), Zurich, Switzerland",Sarajevo,Bosnia and Herzegovina,for his research into the stereochemistry of organic molecules and reactions,https://masterdataapi.nobelprize.org/2/nobelPrize/che/1975,http://masterdataapi.nobelprize.org/2/laureate/248,69,Switzerland,Europe,Bosnia and Herzegovina,47.0,8.43,48.55,5.72,0.0,0.0,0.0,0.0
1975,Literature,Eugenio Montale,male,1896-10-12,,Genoa,Italy,"for his distinctive poetry which, with great artistic sensitivity, has interpreted human values under the sign of an outlook on life with no illusions",https://masterdataapi.nobelprize.org/2/nobelPrize/lit/1975,http://masterdataapi.nobelprize.org/2/laureate/651,79,,,Europe,0.0,0.0,0.0,0.0,42.41,12.74,48.55,5.72
1975,Physics,James Rainwater,male,1917-12-09,"Columbia University, New York, NY, USA","Council, ID",USA,for the discovery of the connection between collective motion and particle motion in atomic nuclei and the development of the theory of the structure of the atomic nucleus based on this connection,https://masterdataapi.nobelprize.org/2/nobelPrize/phy/1975,http://masterdataapi.nobelprize.org/2/laureate/104,58,USA,North America,North America,38.51,-100.3,38.51,-100.3,38.51,-100.3,38.51,-100.3
1975,Medicine,Renato Dulbecco,male,1914-02-22,"Imperial Cancer Research Fund Laboratory, London, United Kingdom",Catanzaro,Italy,for their discoveries concerning the interaction between tumour viruses and the genetic material of the cell,https://masterdataapi.nobelprize.org/2/nobelPrize/med/1975,http://masterdataapi.nobelprize.org/2/laureate/407,61,United Kingdom,Europe,Europe,52.94,-1.23,48.55,5.72,42.41,12.74,48.55,5.72
1975,Physics,Aage N. Bohr,male,1922-06-19,"Niels Bohr Institute, Copenhagen, Denmark",Copenhagen,Denmark,for the discovery of the connection between collective motion and particle motion in atomic nuclei and the development of the theory of the structure of the atomic nucleus based on this connection,https://masterdataapi.nobelprize.org/2/nobelPrize/phy/1975,http://masterdataapi.nobelprize.org/2/laureate/102,53,Denmark,Europe,Europe,56.31,9.69,48.55,5.72,56.31,9.69,48.55,5.72
1975,Medicine,David Baltimore,male,1938-03-07,"Massachusetts Institute of Technology (MIT), Cambridge, MA, USA","New York, NY",USA,for their discoveries concerning the interaction between tumour viruses and the genetic material of the cell,https://masterdataapi.nobelprize.org/2/nobelPrize/med/1975,http://masterdataapi.nobelprize.org/2/laureate/406,37,USA,North America,North America,38.51,-100.3,38.51,-100.3,38.51,-100.3,38.51,-100.3
1975,Peace,Andrei Sakharov,male,1921-05-21,,Moscow,Russia,"for his struggle for human rights in the Soviet Union, for disarmament and cooperation between all nations",https://masterdataapi.nobelprize.org/2/nobelPrize/pea/1975,http://masterdataapi.nobelprize.org/2/laureate/534,54,,,Russia,0.0,0.0,0.0,0.0,61.1,81.38,61.1,81.38
1976,Peace,Mairead Corrigan,female,1944-01-27,,Belfast,Northern Ireland,for the courageous efforts in founding a movement to put an end to the violent conflict in Northern Ireland,https://masterdataapi.nobelprize.org/2/nobelPrize/pea/1976,http://masterdataapi.nobelprize.org/2/laureate/536,32,,,Northern Ireland,0.0,0.0,0.0,0.0,0.0,0.0,0.0,0.0
1976,Physics,Samuel C.C. Ting,male,1936-01-27,"Massachusetts Institute of Technology (MIT), Cambridge, MA, USA","Ann Arbor, MI",USA,for their pioneering work in the discovery of a heavy elementary particle of a new kind,https://masterdataapi.nobelprize.org/2/nobelPrize/phy/1976,http://masterdataapi.nobelprize.org/2/laureate/106,40,USA,North America,North America,38.51,-100.3,38.51,-100.3,38.51,-100.3,38.51,-100.3
1976,Chemistry,William Lipscomb,male,1919-12-09,"Harvard University, Cambridge, MA, USA","Cleveland, OH",USA,for his studies on the structure of boranes illuminating problems of chemical bonding,https://masterdataapi.nobelprize.org/2/nobelPrize/che/1976,http://masterdataapi.nobelprize.org/2/laureate/249,57,USA,North America,North America,38.51,-100.3,38.51,-100.3,38.51,-100.3,38.51,-100.3
1976,Medicine,D. Carleton Gajdusek,male,1923-09-09,"National Institutes of Health, Bethesda, MD, USA","Yonkers, NY",USA,for their discoveries concerning new mechanisms for the origin and dissemination of infectious diseases,https://masterdataapi.nobelprize.org/2/nobelPrize/med/1976,http://masterdataapi.nobelprize.org/2/laureate/410,53,USA,North America,North America,38.51,-100.3,38.51,-100.3,38.51,-100.3,38.51,-100.3
1976,Medicine,Baruch S. Blumberg,male,1925-07-28,"The Institute for Cancer Research, Philadelphia, PA, USA","New York, NY",USA,for their discoveries concerning new mechanisms for the origin and dissemination of infectious diseases,https://masterdataapi.nobelprize.org/2/nobelPrize/med/1976,http://masterdataapi.nobelprize.org/2/laureate/409,51,USA,North America,North America,38.51,-100.3,38.51,-100.3,38.51,-100.3,38.51,-100.3
1976,Physics,Burton Richter,male,1931-03-22,"Stanford Linear Accelerator Center, Stanford, CA, USA","Brooklyn, NY",USA,for their pioneering work in the discovery of a heavy elementary particle of a new kind,https://masterdataapi.nobelprize.org/2/nobelPrize/phy/1976,http://masterdataapi.nobelprize.org/2/laureate/105,45,USA,North America,North America,38.51,-100.3,38.51,-100.3,38.51,-100.3,38.51,-100.3
1976,Economic Sciences,Milton Friedman,male,1912-07-31,"University of Chicago, Chicago, IL, USA","Brooklyn, NY",USA,"for his achievements in the fields of consumption analysis, monetary history and theory and for his demonstration of the complexity of stabilization policy",https://masterdataapi.nobelprize.org/2/nobelPrize/eco/1976,http://masterdataapi.nobelprize.org/2/laureate/688,64,USA,North America,North America,38.51,-100.3,38.51,-100.3,38.51,-100.3,38.51,-100.3
1976,Peace,Betty Williams,female,1943-05-22,,Belfast,Northern Ireland,for the courageous efforts in founding a movement to put an end to the violent conflict in Northern Ireland,https://masterdataapi.nobelprize.org/2/nobelPrize/pea/1976,http://masterdataapi.nobelprize.org/2/laureate/535,33,,,Northern Ireland,0.0,0.0,0.0,0.0,0.0,0.0,0.0,0.0
1976,Literature,Saul Bellow,male,1915-06-10,,Montreal,Canada,for the human understanding and subtle analysis of contemporary culture that are combined in his work,https://masterdataapi.nobelprize.org/2/nobelPrize/lit/1976,http://masterdataapi.nobelprize.org/2/laureate/652,61,,,North America,0.0,0.0,0.0,0.0,54.98,-100.53,38.51,-100.3
1977,Physics,Sir Nevill F. Mott,male,1905-09-30,"University of Cambridge, Cambridge, United Kingdom",Leeds,United Kingdom,for their fundamental theoretical investigations of the electronic structure of magnetic and disordered systems,https://masterdataapi.nobelprize.org/2/nobelPrize/phy/1977,http://masterdataapi.nobelprize.org/2/laureate/108,72,United Kingdom,Europe,Europe,52.94,-1.23,48.55,5.72,52.94,-1.23,48.55,5.72
1977,Medicine,Roger Guillemin,male,1924-01-11,"The Salk Institute, San Diego, CA, USA",Dijon,France,for their discoveries concerning the peptide hormone production of the brain,https://masterdataapi.nobelprize.org/2/nobelPrize/med/1977,http://masterdataapi.nobelprize.org/2/laureate/411,53,USA,North America,Europe,38.51,-100.3,38.51,-100.3,46.97,2.7,48.55,5.72
1977,Chemistry,Ilya Prigogine,male,1917-01-25,"Université Libre de Bruxelles, Brussels, Belgium",Moscow,Russia,"for his contributions to non-equilibrium thermodynamics, particularly the theory of dissipative structures",https://masterdataapi.nobelprize.org/2/nobelPrize/che/1977,http://masterdataapi.nobelprize.org/2/laureate/250,60,Belgium,Europe,Russia,50.67,4.86,48.55,5.72,61.1,81.38,61.1,81.38
